[32m[I 2022-03-27 23:46:47,073][0m A new study created in memory with name: no-name-5541de77-1343-4acd-a291-3dcd586ce840[0m
[32m[I 2022-03-27 23:49:34,561][0m Trial 0 finished with value: 0.9408682634730539 and parameters: {'optimizer': 'SGD', 'learning_rate': 0.06028000000000001}. Best is trial 0 with value: 0.9408682634730539.[0m
[32m[I 2022-03-27 23:53:28,099][0m Trial 1 finished with value: 0.937125748502994 and parameters: {'optimizer': 'Adam', 'learning_rate': 0.06459}. Best is trial 0 with value: 0.9408682634730539.[0m
[32m[I 2022-03-27 23:56:14,459][0m Trial 2 finished with value: 0.936377245508982 and parameters: {'optimizer': 'SGD', 'learning_rate': 0.09637}. Best is trial 0 with value: 0.9408682634730539.[0m
[32m[I 2022-03-27 23:59:02,103][0m Trial 3 finished with value: 0.9333832335329342 and parameters: {'optimizer': 'SGD', 'learning_rate': 0.052890000000000006}. Best is trial 0 with value: 0.9408682634730539.[0m
[32m[I 2022-03-28 00:01:49,391][0m Trial 4 finished with value: 0.9311377245508982 and parameters: {'optimizer': 'SGD', 'learning_rate': 0.00711}. Best is trial 0 with value: 0.9408682634730539.[0m
[32m[I 2022-03-28 00:05:43,467][0m Trial 5 finished with value: 0.9348802395209581 and parameters: {'optimizer': 'Adam', 'learning_rate': 0.08327}. Best is trial 0 with value: 0.9408682634730539.[0m
[32m[I 2022-03-28 00:08:29,859][0m Trial 6 finished with value: 0.9333832335329342 and parameters: {'optimizer': 'SGD', 'learning_rate': 0.09787}. Best is trial 0 with value: 0.9408682634730539.[0m
[32m[I 2022-03-28 00:12:23,090][0m Trial 7 finished with value: 0.9326347305389222 and parameters: {'optimizer': 'Adam', 'learning_rate': 0.07806}. Best is trial 0 with value: 0.9408682634730539.[0m
[32m[I 2022-03-28 00:15:09,912][0m Trial 8 finished with value: 0.9348802395209581 and parameters: {'optimizer': 'SGD', 'learning_rate': 0.01434}. Best is trial 0 with value: 0.9408682634730539.[0m
[32m[I 2022-03-28 00:19:03,004][0m Trial 9 finished with value: 0.9236526946107785 and parameters: {'optimizer': 'Adam', 'learning_rate': 0.04147000000000001}. Best is trial 0 with value: 0.9408682634730539.[0m
loss(train): 0.001	accuracy(train): 0.999	loss(valid): 0.380	accuracy(valid): 0.941
 --- accuracy(test) --- : 0.936
loss(train): 0.002	accuracy(train): 0.999	loss(valid): 0.815	accuracy(valid): 0.937
 --- accuracy(test) --- : 0.918
loss(train): 0.001	accuracy(train): 0.999	loss(valid): 0.411	accuracy(valid): 0.936
 --- accuracy(test) --- : 0.927
loss(train): 0.001	accuracy(train): 0.999	loss(valid): 0.394	accuracy(valid): 0.933
 --- accuracy(test) --- : 0.927
loss(train): 0.001	accuracy(train): 0.999	loss(valid): 0.315	accuracy(valid): 0.931
 --- accuracy(test) --- : 0.931
loss(train): 0.003	accuracy(train): 0.999	loss(valid): 1.065	accuracy(valid): 0.935
 --- accuracy(test) --- : 0.924
loss(train): 0.001	accuracy(train): 0.999	loss(valid): 0.431	accuracy(valid): 0.933
 --- accuracy(test) --- : 0.930
loss(train): 0.003	accuracy(train): 0.999	loss(valid): 0.913	accuracy(valid): 0.933
 --- accuracy(test) --- : 0.921
loss(train): 0.001	accuracy(train): 0.999	loss(valid): 0.332	accuracy(valid): 0.935
 --- accuracy(test) --- : 0.930
loss(train): 0.003	accuracy(train): 0.999	loss(valid): 0.911	accuracy(valid): 0.924
 --- accuracy(test) --- : 0.928
best _accuracy(valid) : 0.941
best_parameters : {'optimizer': 'SGD', 'learning_rate': 0.06028000000000001}
loss(train): 0.001	accuracy(train): 0.999	loss(valid): 0.348	accuracy(valid): 0.939
 --- accuracy(test) --- : 0.926
